{
  "agent_id": "e00820de-129b-4c52-9827-7ba27baeb5ef",
  "agent_name": "cert_test_agent",
  "certificate_hash": "75c7916a8bd1c5963d4e3a831778f19672ed2fba5673b1fd97c4997d83cc5eb9",
  "declared_capabilities_summary": {
    "failed": 0,
    "proven": 1,
    "total_declared": 2,
    "unproven": 1
  },
  "evidence_call_ids": {},
  "expires_at": "2026-05-02T12:02:27.968530+00:00",
  "hashes": {
    "canonicals_hash": "557e849386c243bca00f79ae06453986919b996acb5df2180b86a66db05e00f5",
    "reason_codes_hash": "9f3ff80258d4948d8d77877be5a7783a6afcfd40508b264b50673c568b306471",
    "templates_hash": "fe5286ff0f84c8345b69f06d0bba9fdf6630a1ba10e2a8244abafa104d707ec0",
    "topology_hash": "2424837b8d29cf4adf77941962f51574ea6a32df23db16452c8470dc0416208b"
  },
  "issued_at": "2026-02-01T12:02:27.968530+00:00",
  "proven_capabilities": [
    "CODE_RUN"
  ],
  "schema_version": 1,
  "tier": "YELLOW"
}