{
  "agent_id": "001ef143-89b8-45bc-bf74-74ba1e415aad",
  "agent_name": "cert_test_agent",
  "certificate_hash": "982676e15ff1bffa37fa2d6b55b02ed1cd6eeebe000a800ca58c261d2936d622",
  "declared_capabilities_summary": {
    "failed": 0,
    "proven": 1,
    "total_declared": 2,
    "unproven": 1
  },
  "evidence_call_ids": {},
  "expires_at": "2026-05-02T12:02:10.966880+00:00",
  "hashes": {
    "canonicals_hash": "557e849386c243bca00f79ae06453986919b996acb5df2180b86a66db05e00f5",
    "reason_codes_hash": "9f3ff80258d4948d8d77877be5a7783a6afcfd40508b264b50673c568b306471",
    "templates_hash": "fe5286ff0f84c8345b69f06d0bba9fdf6630a1ba10e2a8244abafa104d707ec0",
    "topology_hash": "62d3c09138e65ea917953b84d38ba8e503475517169576e5e8726fbd1cc2ece9"
  },
  "issued_at": "2026-02-01T12:02:10.966880+00:00",
  "proven_capabilities": [
    "CODE_RUN"
  ],
  "schema_version": 1,
  "tier": "YELLOW"
}